id,name,description,price,image
1,Orange,Oranges are a solid source of fiber. A single fruit contains 12 percent of your daily value.,30,https://upload.wikimedia.org/wikipedia/commons/thumb/e/e3/Oranges_-_whole-halved-segment.jpg/220px-Oranges_-_whole-halved-segment.jpg
2,Apple,Apples are low in sodium fat and cholesterol,40,https://media.istockphoto.com/photos/red-apple-picture-id184276818?b=1&k=20&m=184276818&s=170667a&w=0&h=1jiJbUmZdjOPRlfpz7hKexA0XwEPX2b3YCRvamQhWWY=
3,Mango,are a great source of magnesium and potassium,25,https://images.hindustantimes.com/img/2021/06/02/550x309/9a156550-c367-11eb-9d53-2d5cae187b44_1622619423185.jpg
4,Banana,are a good source of several vitamins and minerals. Especially potassium,100,https://images.immediate.co.uk/production/volatile/sites/30/2017/01/Bananas-218094b-scaled.jpg
5,Watermelon,Watermelon is rich in an amino acid called citrulline that may help move blood through your body and can lower your blood pressure.,200,https://img.onmanorama.com/content/dam/mm/en/food/features/images/2021/2/27/watermelon-seeds.jpg.transform/schema-16x9/image.jpg